{
  "schema_version": "1.0.0",
  "description": "Reference keyword routing data for symptom-to-specialty recommendation. This is a routing aid, not a diagnostic model.",
  "canonical_specialties": [
    "Cardiology",
    "Dermatology",
    "Neurology",
    "Gastroenterology",
    "Pulmonology",
    "ENT",
    "Ophthalmology",
    "Orthopedics",
    "Urology",
    "Nephrology",
    "Gynecology",
    "Endocrinology",
    "Psychiatry",
    "General Practice",
    "Pediatrics",
    "Emergency"
  ],
  "normalization": {
    "case_sensitive": false,
    "trim_whitespace": true,
    "collapse_internal_whitespace": true,
    "unicode_normalization": "NFKC",
    "match_mode": "exact_keyword_after_normalization"
  },
  "symptom_to_specialty": {
    "chest pain": "Cardiology",
    "chest tightness": "Cardiology",
    "chest pressure": "Cardiology",
    "palpitations": "Cardiology",
    "racing heartbeat": "Cardiology",
    "irregular heartbeat": "Cardiology",
    "ankle swelling": "Cardiology",
    "exercise related chest discomfort": "Cardiology",
    "skin rash": "Dermatology",
    "rash": "Dermatology",
    "itchy skin": "Dermatology",
    "hives": "Dermatology",
    "eczema": "Dermatology",
    "acne": "Dermatology",
    "psoriasis": "Dermatology",
    "hair loss": "Dermatology",
    "nail changes": "Dermatology",
    "headache": "Neurology",
    "migraine": "Neurology",
    "seizure": "Neurology",
    "seizures": "Neurology",
    "fainting": "Neurology",
    "numbness": "Neurology",
    "tingling": "Neurology",
    "tremor": "Neurology",
    "memory problems": "Neurology",
    "balance problems": "Neurology",
    "abdominal pain": "Gastroenterology",
    "stomach pain": "Gastroenterology",
    "persistent heartburn": "Gastroenterology",
    "acid reflux": "Gastroenterology",
    "difficulty swallowing": "Gastroenterology",
    "persistent diarrhea": "Gastroenterology",
    "persistent constipation": "Gastroenterology",
    "blood in stool": "Gastroenterology",
    "bloating": "Gastroenterology",
    "shortness of breath": "Pulmonology",
    "persistent cough": "Pulmonology",
    "wheezing": "Pulmonology",
    "coughing blood": "Pulmonology",
    "breathing difficulty": "Pulmonology",
    "chronic sputum": "Pulmonology",
    "sore throat": "ENT",
    "ear pain": "ENT",
    "hearing loss": "ENT",
    "sinus congestion": "ENT",
    "persistent nasal congestion": "ENT",
    "recurrent sinusitis": "ENT",
    "hoarseness": "ENT",
    "loss of smell": "ENT",
    "blurred vision": "Ophthalmology",
    "eye pain": "Ophthalmology",
    "red eye": "Ophthalmology",
    "double vision": "Ophthalmology",
    "vision loss": "Ophthalmology",
    "flashes in vision": "Ophthalmology",
    "joint pain": "Orthopedics",
    "knee pain": "Orthopedics",
    "back pain": "Orthopedics",
    "shoulder pain": "Orthopedics",
    "sports injury": "Orthopedics",
    "fracture": "Orthopedics",
    "muscle pain": "Orthopedics",
    "painful urination": "Urology",
    "burning urination": "Urology",
    "urinary frequency": "Urology",
    "urinary urgency": "Urology",
    "blood in urine": "Urology",
    "difficulty urinating": "Urology",
    "kidney stone symptoms": "Urology",
    "flank pain": "Nephrology",
    "recurrent kidney problems": "Nephrology",
    "swelling with kidney disease": "Nephrology",
    "irregular periods": "Gynecology",
    "pelvic pain": "Gynecology",
    "abnormal vaginal bleeding": "Gynecology",
    "painful periods": "Gynecology",
    "vaginal discharge": "Gynecology",
    "menopause symptoms": "Gynecology",
    "excessive thirst": "Endocrinology",
    "frequent urination with thirst": "Endocrinology",
    "thyroid symptoms": "Endocrinology",
    "unexplained weight change": "Endocrinology",
    "heat intolerance": "Endocrinology",
    "cold intolerance": "Endocrinology",
    "persistent low mood": "Psychiatry",
    "panic attacks": "Psychiatry",
    "severe anxiety": "Psychiatry",
    "sleep problems with mood symptoms": "Psychiatry",
    "fever": "General Practice",
    "fatigue": "General Practice",
    "general weakness": "General Practice",
    "unexplained weight loss": "General Practice",
    "multiple nonspecific symptoms": "General Practice",
    "child fever": "Pediatrics",
    "child cough": "Pediatrics",
    "child vomiting": "Pediatrics",
    "child diarrhea": "Pediatrics",
    "child rash": "Pediatrics"
  },
  "emergency_overrides": {
    "severe chest pain with breathing difficulty": "Emergency",
    "chest pain with fainting": "Emergency",
    "sudden one-sided weakness": "Emergency",
    "sudden facial droop": "Emergency",
    "sudden speech difficulty": "Emergency",
    "severe breathing difficulty": "Emergency",
    "coughing large amounts of blood": "Emergency",
    "uncontrolled severe bleeding": "Emergency",
    "loss of consciousness": "Emergency",
    "severe allergic reaction with breathing difficulty": "Emergency",
    "seizure lasting unusually long or repeated without recovery": "Emergency"
  },
  "routing_policy": {
    "priority": [
      "Emergency",
      "Pediatrics",
      "keyword_specialty",
      "General Practice"
    ],
    "safety_note": "Emergency patterns must be evaluated before ordinary specialty routing. The mapping must not be used to diagnose a condition or delay urgent care.",
    "ambiguity_note": "Symptoms can belong to multiple specialties. This dictionary intentionally stores a primary routing target; downstream AI/backend logic may ask follow-up questions or use a broader clinical triage rule."
  }
}